id,title,category,difficulty_1_easy_5_hard,time_estimate_hours,recommended_fabric,notions,sensory_notes,tags
183,Gothic Lace Cuffs,Pet,4,1.0,"denim, cotton",invisible zipper,"adjustable closures, soft edges","zero-waste, weekend, sensory-safe"
184,Fingerless Gloves,Quilting,5,4.0,jersey knit,"D-ring, buttons, snaps","soft edges, no metal hardware","advanced, sensory-safe, weekend"
185,Bell Sleeves Add-on,Embellishment,2,0.5,"denim, satin","cord, zipper, invisible zipper","lined for softness, adjustable closures","machine-only, zero-waste, intermediate"
186,Ruffle Collar Add-on,Pet,1,1.0,"minky, chiffon",elastic,"flat elastic, lined for softness","quick, sensory-safe, weekend"
187,Peplum Add-on,Adaptive/EDS-friendly,3,4.0,"cotton, denim","foam stabilizer, lobster clasp, snaps","tagless seams, soft edges","sensory-safe, weekend, advanced"
188,Faux-Button Placket,Pet,5,6.0,"thrifted sheet, linen","invisible zipper, hook & loop, lobster clasp","minimal seams, adjustable closures","advanced, sensory-safe, scrap-buster"
189,Lace-Up Panel,Gifts,5,2.0,flannel,"cord, double fold bias","minimal seams, soft edges","machine-only, sensory-safe, scrap-buster"
190,Grommet Belt,Embellishment,3,0.5,"linen, cotton","cord, invisible zipper, magnetic clasp","no raw edges, adjustable closures","zero-waste, machine-only, sensory-safe"
191,Skull Appliqué,Accessories,2,6.0,linen,"D-ring, double fold bias, elastic","breathable fabric, no raw edges","machine-only, stretch, sensory-safe"
192,Patch Jacket,Repairs/Mending,1,4.0,denim,"elastic, cord, buttons","tagless seams, minimal seams","hand-sewing, intermediate, beginner"
193,Studded Epaulettes (Soft),Pet,3,6.0,cotton,lobster clasp,"tagless seams, flat elastic","stretch, advanced, no-pattern"
194,Capelet,Quilting,4,2.0,"canvas, minky","double fold bias, bias tape","stretch-friendly, no raw edges","no-pattern, zero-waste, intermediate"
195,Overskirt,Home,5,3.0,thrifted sheet,elastic,"tagless seams, flat elastic","sensory-safe, no-pattern, machine-only"
196,Circle Cape,Pet,5,3.0,"fleece, minky","buttons, lobster clasp","minimal seams, soft edges","beginner, no-pattern, stretch"
197,Opera Gloves (Stretch),Repairs/Mending,1,1.0,linen,"bias tape, drawstring, invisible zipper","tagless seams, minimal seams","scrap-buster, beginner, stretch"
198,Harem Pants,Gifts,2,4.0,cotton,invisible zipper,"minimal seams, no metal hardware","hand-sewing, scrap-buster, zero-waste"
199,Genie Pants,Upcycle,3,1.0,"flannel, fleece","invisible zipper, buttons","tagless seams, stretch-friendly","hand-sewing, advanced, stretch"
200,Satin Sash,Organizers,4,0.5,"upcycled tee, thrifted sheet","interfacing, foam stabilizer","lined for softness, adjustable closures","advanced, weekend, stretch"
